,review,assessment
50,"Прекрасная игра на логику и мышление. Несколько уровней сложности. Купили ребёнку 12 лет, с некоторыми уровнями с трудом справился папа. Небольшой размер - можно взять в дорогу, качественное исполнение. Лучшее средство для отвлечения от гаджетов!, ",True
51,"Заказывала товар ребёнку на день рождения. Хотели не простой и качественный деревянный набор. Я опишу подробно,  а вы решите стоит ли он этих денег. Шахматные фигуры деревянные,  но очень маленькие.  Шашки пластик. Сама доска обклеена бумагой,  поэтому не  понятно на сколько этот рельно дерево, а не фанера сложно судить. На поле видно, что при облейке туда попадала пыль и за счет этого мелкие бугорки образовались.  Края доски уже стёрты в новом. Не могут такого качества шахматы стоить 2600, ",False
52,"Отличная игра, яркая, красочная. Покупали ребенку на подарок.  Теперь играем, всей семьей, ",True
53,"Интерсная развивающая игра. Можно собирать по инстуркции, можно просто катать машинки и возить в них грузы., ",True
54,"сама ""доска"" бестолковая, мягкая, буквы на ней держатся плохо. но сам набор неплох, много букв, достаточно для составления множетсва слов и даже фраз. буквы хорошо держатся на холодильнике), ",True
55,"По опыту играть можно намного раньше (в 10 лет слишком просто) сразу после лото-домино., ",True
56,"Отличная игра, играем всей семьей, брали и себе и на подарок, у нас уже несколько вариантов, ",True
57,"Мой сын в 8 лет любит покрутить листочки из этого блокнота. Удобно, что можно оторвать лист и взять с собой, подумать, например, в дороге. Мне и самому нравится. Рекомендую!!!  Купил 2 части. Ещё бы третью выпустили бы...., ",True
58,"Заставляет думать над картиками, развивает пространственное восприятие и перспективу. Играли детки 10, 5 и 43 лет., ",True
59,"Нам подарили игру на день рождения. Очень понравилась, дети от 5 до 8 играют с удовольствием, да и взрослые тоже. Доставать детали не так уж и сложно, есть парочку, над которыми дольше всего сидишь, но справляются даже дети. В общем мы очень довольны), ",True
60,"Игра очень увлекательная. Ребенок играл в садике, это была его самая любимая игра. Он просил домой такую же. Пошли в ыикспрайс и купили такую же игру за 200руб., только вместо щенка там сидит пингвиненок., ",True
61,"Игра безумно интересная! Играли в неё 2 дня. Некоторые загадки ну ооочень сложные даже для взрослых, но на сайте игры можно получить подсказки и ответы.  За 2 игры не открыли всё карточки и локации, с радостью сыграем ещё.  Качество на высшем уровне, открываешь коробку и сразу погружаешься в атмосферу игры. , ",True
62,"Игра качественная. Но есть много минусов!, ",False
63,"Нам подарили на 2 года. Я думала будет не интересно, так как пирамидки мы собираем уже давно. А вот и нет. Больше двух карточек пока не собираем. Ребенок пока не хочет собирать по картинке. Собирает свое. Нравится. Если совпадает - очень радуется. Дорогая игрушка. Но, если подарят - не отказывайтесь., ",True
64,"Очень достойная настольная игра. Мы брали в дорогу , детям ну очень понравилась . От души рекомендую., ",True
65,"Не хватает фантазии придумывать интересные ассоциации 😅, ",True
66,"Супер! Отличная игра, сложить в коробку правильно - тоже ребус), ",True
67,"Купили дочери игру в 4года . Сейчас ей 7, до сих пор собираем всю серию данных мемополий. Игры интересные, поучительные. Нравится старшей, теперь и младшую  (3 года) учит в них играть. Да и сама я с удовольствием играю) Например, мемополия про космос открыла для много интересных фактов!, ",True
68,"Огромное спасибо создателям игры. Все досочки прекрасно оттесаны, ровные, гладкие, приятно держать в руках. Чистые цвета, глянцевые поверхности. Детали хорошо ложатся и двигаются. Родителям очень советую ознакомиться как играть, например на видео у В. Паевской. Важно уметь правильно давать игрушку, чтоб ребёнку по своему возрасту было по силам и не расстраивался, складывать от простого к сложному.Это первый уровень игры. Игра пригодится надолго. Советую., ",True
69,"Игра зашла на УРА!!! с первого раза (когда ещё и правила толком не запомнили). Интересно, весело, непредсказуемо для всех возрастов. Привлекательна игра и тем, что раунд не затягивается, что хорошо, когда в доме есть непоседы вроде моей дочи  - ещё и поэтому она с радостью играет. Отдельное спасибо за то, что пакетик не одноразовый, и в нем удобно хранить карты и кубик. Советую однозначно., ",True
70,"Очень интересная игра для ребенка. Увлекает. Можно играть не по заданиям, а как в ролевую игру. В комплекте книжка со сказкой Красная шапочка без текста - ребёнок сам по рисункам рассказывает сказку. Игра будет интересна детям 3-5 лет, хотя и наши старшие дети 7 и 9 лет тоже играют с интересом. , ",True
71,"Ребёнок берёт в школу играть на перемене. Нет обозначения для ""дамок"" в шашках, не удобно, когда шашку переворачиваешь - она чёрная, если ""дамки"" есть у обоих игроков, то вообще уже не понятно где чья. Можно взять например более мелкие шашки - которые предназначены для нард. Но не понятно, что мешало продумать ситуацию с ""замками"", поставили бы просто точки разных цветов на обратной стороне шашки. , ",True
72,"Отличная игра. Все детальки выполнены аккуратно, хорошо обработаны, яркие. 
Ребёнок играет в удовольствие, ",True
73,"Игра понравилась детям)) и 7-летнему, и 2-летнему., ",True
74,"Отличная игра, крупные детали, объемные фигуры, автобус, палатки, я взрослый человек сама хочу в нее играть.  Несколько уровней сложности. Как тетрис, две детали ставятся по заданию, остальные надо расположить так что бы все встало на свои места. , ",True
75,"Купил два уровня- 1 и 3. Сын из смешал;) теперь интересно нам обоим!, ",True
76,"Интересная игра на память и внимание. Подойдёт детям от 3х лет и взрослые играют с удовольствием. Затягивает. Имеет звуковое сопровождение. Цель повторить кнопку цвета и количество нажатий этого цвета. Начинается с одного цвета,а потом добавляются все с разным количеством нажатии., ",True
77,"Игра супер. Интересно ребёнку 8 лет и взрослому. Спасибо. , ",True
78,"Классная игра, ",True
79,"Ещё в старой упаковке, но уже от СпинМастер с новым логотипом. До такого был без маркировки СпинМастер в другой коробке и другим лого (кубик в центре, а не просто надпись Рубикс) с подставкой уже без наклеек - в остальном крутится и выглядит так же как он. А вот до того ещё был вариант с наклейками - очень не очень для лицензионного кубика - и скрипел и наклейки загибались. У этого же артикул 6062938 - подставка треугольная пластиковая есть в комплекте. В новых коробках от СпинМастер, где кубик плотно облегает пластиком по граням - новый вариант от СпинМастер... вроде завод сменился или просто переработали механизм и дизайн - внутри есть скошенные кубики, а сами тайлы цветные чуть меньше размером т.е. черного пластика вокруг больше. Ну и нет подставки - внизу в картоне просто пусто. Так что кому нужен более классический кубик с подставкой, то берите именно 6062938 пока имеется везде в продаже пусть он чуть и дороже - скоро не будет., ",True
80,"Интересная игра, увлекательная и понятная. Играют все от мала до велика, ",True
81,"Нашей семье понравилось, играем от мала до велика, очень увлекательное занятие. , ",True
82,"Идея отличная. Что-то подобное было и в моем детстве. Единственное качество какое-то одноразовое.хлипкая конструкция. А так очень интересно... Сломалась моментально, ",False
83,"Классная игра на логику, кажется, всё так просто, но пораскинуть мозгами придётся, советую приобрести, не заскучаете ни вы, ни ребенок, ",True
84,"Отличная игра для тренировки памяти, ",True
85,"Отличная игра, множество вариаций, с дочкой 5ти лет играем очень развивательно. Монетки классные как настоящие. Очень  интересная задумка мобильной игры в коробочке. Можно брать с собой ), ",True
86,"Игра небольшая по габаритам. Поле, куда вставляется буква, с бортиками. То есть, буква не съедет. Очень удобная, правила описаны в доступном  формате, ",True
87,"Купили со скидкой за 329 руб, ",True
88,"Игра понравилась. Своих денег со скидкой стоит. Немного не понравилась крышка, которую обязательно нужно придерживать или полностью раскладывать. Рисунки могли бы быть и симпатичнее, более реалистичные что ли.., ",True
89,"Играем с дочкой вдвоем. Я почему-то всегда банкрот 😁, ",True
90,"Супер игра! Играем с дочкой, ей 6 лет. Вся семья любит этот мультик и игра тоже интересная и классная, рекомендую!, ",True
91,"Офигенная игра. Для 4,5 лет не понятно немного, от 6 лет, думаю, отлично. Вся игра из хорошего пластика, фишки крупные.  Купила всего за 99 руб., ",True
92,"Хорошая. Картинки реалистичные, как на коробке, размером с игральные карты. Можно и для малышей 1+ использовать., ",True
93,"Игра очень нравится моему сыну. Начали играть в 2.1 с первого уровня, сейчас сыну  3.3 года играем карточками 4 уровня. Так же прошлой зимой и сейчас в ходу ""я леплю снеговичка"" из этой серии. Но, она сложнее поэтому снеговичков рекомендую всё же с 3х, ",True
94,"Неплохая игра, но детям 6 и 10 лет быстро наскучила. Хотя в отзывах писали, ято занимательно и для взрослых. Было интересно только собрать фигуры назад в деревянный поддон. Не с 1-го раза получилось. Купила за 225 за вычетом бонусов, промо-кодов и акций, ",True
95,"Малышке, 2 года очень понравился зайчик ) играет с удовольствием) фигуры изготовлены качественно ), ",True
96,"Многофункциональность - это ""конёк"" фабрики ""Алатойс"") Детей можно занять на длительное время.  Расскажу в какие игры можно играть: 1. «Знакомимся с буквами»Цель: закрепление в памяти образа и названия букв, развитие зрительного внимания, мелкой моторики; 2.«Сложи слово» цель: учить составлять и читать слова, развивать зрительное внимание, мелкую моторику; 3.«Прочитай слово» цель: тренировка навыка чтения, развитие зрительного внимания, памяти; 4.	«Исправь ошибку» Цель: развитие зрительного внимания, мышления, тренировка мелкой моторики (ребёнок выкладывает слово, закрывает глаза, а Вы меняете 1 или несколько букв после чего ребёнок должен найти ошибку и исправить); 5. «Знакомимся с цифрами» цель: закрепление в памяти образа и названия цифр, развитие зрительного внимания, мелкой моторики; 6. «Учимся считать» цель: тренировать навык прямого и обратного счёта, развитие зрительного внимания, мелкой моторики; 7. «Сначала-потом», ""Перед-после""Цель: развитие слуховой памяти, закрепление названий цифр и букв, тренировка мелкой моторики; 8. «Чего не стало?» (продолжение игры «Сначала-потом») цель: развитие зрительной памяти, закрепление названий цифр и букв; 9. «Решаем примеры» цель: учить решать примеры, развивать зрительное внимание и мелкую моторику., ",True
97,"Покупали шар головоломку, намного интереснее и всю дистанцию видноВ квадрате же не видно куда катить шар , шар мелкий, его плохо видно Кто думает о покупке такого куба, подумайте насчёт шара , он в тысячу раз удобнее Была бы возможность , вернула бы сразу в магазин этот куб ?, ",False
98,"Очень классная игра. Дочке 5 лет , играем всей семьей. Если на какие то вопросы не знает ответы, запоминает!, ",True
99,"Покупала по рекомендации, что именно у этого производителя качественно сделано. В итоге разочарована! Не все детали хорошо прокрашены, а штырьки сверху вообще плохо сделаны (неровная поверхность, легко подцепить занозу!). Такое ощущение, что для рекламы производитель присылает идеальные образцы, а не те, что в продаже. Уже второй раз разочаровывает качество этого производителя, ",True
100,"Сначала не поняли, что так легко то🤣 а когда на страницу эксперта перелистнули, тут уже всей семьёй сидели собирали 😁, ",True
101,"Брали, ребенок сидит по долгу занимаеться. Процес нравиться. , ",True
102,"Яркий красивый ,но зачем нарисовали фигурки на доске как складывать зачем, в чем тогда сложность,даже думать не надо., ",True
103,"Купила думала как раньше были. А картинка вся вываливается по квадратикам, смысл тогда., ",False
104,"Качество отличное. Мало вариантов игры с ребенком , ",True
105,"Отличная игра!
Цена очень порадовала, упаковка в норме., ",True
106,"В целом хороший набор. Ребенку 2г понравилось, но уже очень легко. Лучше бы купила подороже, но с магнитными основами, а то здесь все фишки съезжают при малейшем движении. Пришлось купить комплект липучек и самой уже доработать., ",True
107,"Для ребёнка 6 лет слишком простая. Обрадовало только, что на скорость-хоть какой-то азарт. Качество, конечно, отменное. За 800 рублей неплохо, за полную стоимость- так себе игра. Для детей лет 4-5 будет, думаю, интересно., ",True
108,"Интересная головоломка Увлекает надолго и детей и взрослых. Брали в поезд полчаса тишины))) мало места много эмоций рекомендую ??, ",True
109,"Хорошие, интресные карты, но значительно тоньше, чем те, которые мы покупали с полем. Разница в том, в тех есть орг.стекло, а в этих нет.
В мыслях даже не было посмотреть на такую деталь. Думала, что все карточки будут одинаковые.
На фото видно, что на одних есть отлебск от ламны, а на другой почти нет. На которых видно - это та самая колода «пандора», ",True
110,"Идея игрушки естественно прекрасна) , ",True
111,"хорошие карточки. купили как допкомплект для диксит., ",True
112,"Классика бндибон. Качество,как всегда, на высоте, ",True
113,"Выбрала как подарок племяннику на 10 лет. Оказывается ему очень понравилпсь данная игра, и он ей был очень  рад! Игра понятна, всё доступно описано. На подарок не плохой вариант) , ",True
114,"Крепкие магниты. Держатся хорошо. Для мальчишек! Можно играть на магнитных планшетах харди гарди, а можно на холодильнике. Лайфхак: не выбрасывайте планшет с силуэтами, когда выдавите машины — это может быть отличный сортер или трафарет для рисовалок)) , ",True
115,"Несоответствие картинки и самого товара. Фишки сделаны из дешевого пластика. Цифры нанесены просто поверхностно, а не углублены. Производитель изменил игру, но при этом оставив прошлую упаковку - по сути это обман., ",False
116,"Ребенку 6лет игра очень нравится. Качественно все сделано.приятно держать в руке. Задания интересные. Маркер ленко стирается влажной салфеткой, потом  можно снова решать/проходить задания.Брала по акции за 399 руб., ",True
117,"Хотела взять бондибон, но цена ровно вдвое выше со всеми скидками. Потом в ютубе увидела поле и поняла, что это ровно та же игра, но без громкого имени. Из сюризов - инструкция на китайском. Но всё понятно - пятнашки все играли. Качество прекрасное. Небольшое поле, приличный пластик, запаха нет, зазубрин тоже. Те же 60 заданий, что и у дорогой марки. , ",True
118,"Очень долго ждал малыш! И вот он ! Хорошая игрушка. Иногда и сами в руках повертеть не прочь.., ",True
119,"Очень понравилась,играем с ребенком, ",True
120,"Простая, но очень красивая головоломка. В коллекцию самое-то. , ",True
121,"Прекрасное лото, покупала раньше лото ""овощи"" и ""алфавит"", в них были большие, удобные мешочки, тут такой мешок, что просто ужас, туда еле как помещаются карточки, завязки не завязать, фишки вываливаются. Поэтому минус звезду. , ",True
