,review,assessment
0,"Покупали для 5летнего ребенка.Пока до полной победы/поражения усидеть не может. В целом задумка неплохая,но есть и недочеты,о которых здесь много уже написано,но производителем не читается)). Слабо закрепляются фишки в полях,если вы придерживаете рукой нижнее поле,то белые/красные фишки могут вылететь(нужно бы двойное дно),с верхнего поля тоже вылетают,чуть пошевелишь чемоданчик.Плохо видны цифры и буквы.Мелкие фишки не считаю недостатком-тренируется мелкая моторика,в том числе и у взрослых., ",True
1,"Хороший способ научить детей играть в эту великолепную игру. Простые карточки, играли вчетвером: мама, папа, 12 и 6 лет. Маленькому чуть сложновато было, но постепенно понял суть. Конечно приходилось иногда подыгрывать. Теперь хотим карточки посложнее, так как это интереснее., ",True
2,"Купила, чтобы поиграть вечерком. Пока разобрались, пока поиграли и получили потрясные эмоции, на часах оказалась полночь? играли всей семьей(деткам 4,5 года). Вроде были заинтересованы, но боюсь, что они не совсем понимали, что происходит? Нам понравилось, ставлю твердую 5, ",True
3,"Играем с первоклассником, ответы не все знает. Есть над чем работать ещё) Вопросы на разные темы, например: ""Сколько нужно отнять от 9, чтобы получилось 6?"", "" У белки-летяги есть крылья?"", ""Что изображено на гербе России?"", "" Как называются морские разбойники?"", ""Сколько всего цифр существует?"", "" При какой температуре закипает вода?"", ""Как назвать время 7:40 по-другому?"". Карточки вопросов разделены по уровням сложности и отличаются цветом, можно играть с более младшими детьми, убрав сложные вопросы., ",True
4,"Очень понравилась игра. Ребенку 6 лет интересно играть, взрослым - тоже! Это отличная возможность провести время вместе с ребенком и чтобы всем было интересно и весело. Здорово развивает образное мышление, а ещё сближает) мы в восторге. Большой плюс, что партия длится не очень долго. У нас ушло минут 20. Это очень удобно, ",True
5,"К качеству исполнения игры вопросов нет, на высоте.
Но содержание а именно картинки, не понравились, мне показалось мрачным и где-то давящими на психику.
Не все картинки такие, но из 99 шт больше половины зубастые и мрачные, с синяками под глазами. Своему ребёнку однозначно не буду показывать. Были бы картинки добрее, может какието действия добрые были бы изображены. Посыл мне не понятен. Время все-же с ребёнком нужно проводить с пользой, здесь я её не вижу. , ",False
6,"Грустные, тревожные,печальные картинки. Тема войны, апокалипсиса, злые монстры. Игра отличная. Это наш второй набор. Но именно в него не хочется играть, тем более с ребёнком., ",False
7,"Игра очень интересная. Расскажу сначала: у дочки есть достаточно много настольных игр (6 лет), играть любит,  и вся детвора, что приходит в гости, с удовольствием играют во все игры.  На Новый год набрала много подарков для доченьки и случайно увидела эту игру с хорошей скидкой. Мне стало любопытно. Посмотрела обзор на сайте Игротека, там лучше чем везде рассказывается об игре, а главное правила, которые достаточно интересны и оригинальны(я бы точно не разобралась с первого раза!но с обзором было не сложно). Дети в таком восторге, вы бы знали, и взрослые не менее заинтересованы. Конечно, первое время лучше играть большой компанией и с родителями на подмоге, но как дети до конца все усвоят, помощь им точно не будет нужна. Теперь хотим взрослую игру Клюедо и другие подобные игры., ",True
8,"good. at 3- 6 old the liked it🧱, ",True
9,"Купила для сына, куда полезнее будет смартфонов! Сама тоже играю))) вспомнила молодость, эх), ",True
10,"Взрослые не смогли собрать , лежит и всех бесит 🤣, ",True
11,"Здравствуйте. Общие впечатления самые положительные, игра из детства, только у нас был морской бой. Покупали сыну 4 года, но для него сложно. На упаковке написано от 7 лет, оно и верно. Надеюсь позже будет заинтересован. Но вот взрослые играли с удовольствием. Одно но, крышка от чемоданчика, если заденешь, то падает, соответственно фишки тоже, что неудобно для ребёнка. Поэтому минус одна звезда., ",True
12,"Обалденная игра. Зависли на все выходные. Качество тоже отличное , ",True
13,"Сначала сборник игр произвёл хорошее впечатление, но когда начинаешь играть выясняются «сюрпризы». Например в инструкции о правилах в шахматах написано: посмотрите в интернете. Wtf? Так можно написать на каждую игру и не заморачиваться с печатанием инструкции. О чем собственно производитель подумал и решил к игре Мемополия и Фотовикторина не прикладывать инструкций вообще. По поводу качества игр: поле для шашек и шахмат и сами фигуры можно было ещё меньше сделать??? Понятно, что игра для детей, но они учатся играть со взрослыми и такой mini формат крайне не удобен. Так же в Падающей башне плохо зашлифованы бруски.  Ребёнок все равно доволен, но я как человек заплативший за эту игру крайне возмущена. Эти игры можно было все по отдельности приобрести и вероятность брака была бы ниже, я купилась на упаковку (хранить удобнее). Скупой платит дважды, как минимум шашки с шахматами придётся брать новые., ",False
14,"Хорошая, простая игра для малышей 3-6 лет,  пластиковая лопатка-вертушка добавляет интереса детям, 2 уровня сложности, нам понравилась, сыну 3,7 тоже, играли раз 10 за 2 дня., ",True
15,"Отличная развивающая игра для ребенка 4-5 лет. По моему мнению это лучшая подборка игровых полей в серии пикторин. Ребенку очень нравится., ",True
16,"Хорошая игра, играем с удовольствием. Но в нашей коробке оказался некомплект - не было карточек, увидели только дома. Советую проверять при покупке, я понадеялась, что коробка закрыта и все на месте. , ",True
17,"Геоборд супер. Много карточек с примерами рисунков. Дочке 4,9 увлеклась, да и сама потом без картинок стала фантазировать. Мне тоже интересно, с удовольствием отвлеклась., ",True
18,"Рада покупке, Давно искала шахматы с красивыми фигурами-эти для меня идеальны. Не поленилась и на кассе проверила наличие ссех фигур и правильность комплектации-все отлично. Магниты во всех фигурах, даржат хорошо., ",True
19,"Рисунки отличные, не наклеенные. Но ребенку 5 лет скучные, ",True
20,"Брала игру для себя, играем на работе - счастью нет предела! Мечтала об этой игре с 2010 года и вот - сбылась.
Очень интересные задания, продуманные пути. , ",True
21,"Отличная игра! Гораздо интереснее многих более дорогих (у нас много разных). Одна из самых любимых!, ",True
22,"Раньше брал эту же игру за 529 рублей, потом подарил сестре. Решил снова купить, но подороже мол в коробке, удобно, все дела. Когда открыл, был разочарован. К самому содержимому претензий нет. Ничего не поломано, не порвано, всё содержимое на месте. Но есть претензии к самим картам. Карты маленькие, очень тонкие, не удобно ими играть. Те, что я покупал ранее (за ₽529), больше размером, толще картон, а, соответственно, более плотные, так ещё и в 3 раза дешевле (даже не в 2, а в 3). Не ведитесь на коробку., ",False
23,"Поиграли на ура. Качество отличное, карточки сами пластиковые. Не пожалеете о покупке. Как играть посмотрели на двух видео. Две колоды, синяя недвижимость, красная игровая, деньги и сюрпризы. Раздали по 5 игровых карт каждому, с синей верхнюю открыли, каждому по карте с красной колоды. Каждый делает ставку одновременно или пасует. Кто первый собрал 3 рядя цветовой недвижимости, тот и выиграл. В улу цифра говорит о количестве необходимых карт недвижимости. , ",True
24,"Купила сыну любителю шахмат в дорогу играть, но: 1 разочарование это не узнаваемый фигуры (сами на себя не похожи), 2 в этот же день сломался замок и теперь брать с собой их не возьмешь, ",True
25,"Набор игр достаточно интересный, в нашей семье играли дети всех возрастов, от 6 до 12 лет., ",True
26,"Средне,управлять шариком трудно было девочке 13 лет. На вид пластмасса и крылья такие себе . В общем по мне цена завышена за пластиковую головоломку., ",True
27,"За 50 р достойная игра, ",True
28,"Если дети постоянно шумят,бегают по комнатам,сбивая малышей с ног. Просто купи им Уно и они 1 час спокойно посидят и весело проиграют. Игра для деток школьников., ",True
29,"Может, мы в чем-то не разобрались, но после открытия ждало разочарование. Дешевые белые буквы на полых квадратиках и отдельно полуразрезанный лист с магнитами на поролоне.  Поролон надо вставлять в буквы, он не держится, выпадает, надо придумывать какой-то клей. Надо было пометить, что это набор ""сделай сам"" сомнительного качества.  Игровое поле бумажное, хлипкое., ",False
30,"Качественная бумага купюр, красочные, прорисованы (50,100,200,500,2000,5000). Монеты пластмассовые (1,2,5,10). Монеты 2 и 5 одного размера. По количеству не считала. Коробка с лотками бумажная, думала пластик., ",True
31,"Отличное домино в коробочке. Цена 119 была. , ",True
32,"Отличная игра,играем с детьми с удовольствием.Всем советую.А для деток помладше есть вариант scrable в голубой коробке., ",True
33,"Игра хорошая. Нам понравилась, дети играют с удовольствием. Единственное, что я бы поменяла, буквы и цифры на поле нужно как-то выделить, другим цветом, а то они синие на синем фоне, плохо видно, нужно приглядываться... , ",True
34,"Очень интересная игрушка. Дети 4 и 8 лет запоминают и все верно выставляют.еще прячут детальки и спрашивают, какого животного не хватает. Хорошее изделие без изьянов. Вышла со скидками и бонусами за 300 руб. Идеально, ",True
35,"Задумка у игрушки хорошая. Дочери 3.5, игрушка заинтересовала, задания понятные, интересные, но само исполнение игрушки не очень. Отверстия не совпадают, из за этого не всегда горит лампочка при правильном ответе, приходится в этот момент помогать ребёнку, и выглядит это все как то хлюпенько., ",True
36,"Отличная игрушка для всей семьи , ",True
37,"Доска хорошая, качественная, массивная. Но, вот сами фигуры и шашки хлипкие. Шашки вообще тонюсенькие. Разметки цифро-буквенной нет на доске, если надумаете заниматься шахматами, разучивая  партии, не получится. Внутренняя часть, где шахматы лежат, у меня с одной стороны отошла, неудобно,  мешает, надо клеить или вообще убрать, а фигуры хранить внутри россыпью. , ",True
38,"Хорошая, качественная картинка. Но нет грань которые держали бы квадратики между собой и они выпадают. Чтот очень не удобно, можно легко потерять. В дорогу с собой никуда не возьмешь. Очень расстроена, ждали игрушку как была у меня в детстве, а пришло совсем не то., ",True
39,"В целом задумка игры на развитие мышление,  моторики очень достойна. Взяла дочке на 4 года. Но очень расстроило, что в инструкции есть расхождение в цвете деталей (1шт), при чем темно синяя деталь в инструкции обозначена как фиолетовая??‍♀️  Я специально не брала дешевый вариант такой игры, так как читала что там такое встречается. И каково было мое разочарование, когда я увидела такое в этой игре!((((, ",True
40,"Долго хотела купить и не пожалела, что купила!цена по скидке 449 руб. для такой игры просто отлично!  Ребёнку 5,5 лет заинтересовала, очень мотивирует зелёная лампочка, которая загорается при правильном ответе! Благодаря этой лампочке ребёнок прежде чем соединить ответы думает и радуется когда видит что правильно отвечает.  Качество хорошее, задумка отличная. Для работы нужны 2 батарейки АА в комплект не входят., ",True
41,"Была не внимательна, конечно, но никак не ожидала, что внутри будут не магниты, а наполнитель с магнитным слоем. Пластиковые фишки все в зазубринах, после вставки этой подушечки она вылетает. Количество фишек не соответствует заявленному в инструкции, хоть и не критично для игры. И самое главное (я конечно ориентируюсь на старый советский реально магнитный вариант такой игры) нет полосок для игроков. Куда, спрашивается набрать эти 7 букв, как и где их держать, чтобы другие не видели? Разочарована полностью. Не рекомендую!, ",False
42,"Прекрасная игра, дошкольнику очень понравилась. Если бы листы с заданиями были на плотной бумаге, чтобы постоянно не поправлять при сдвигании, было бы еще лучше. , ",True
43,"Классная игра! Быстрая, лёгкая, весёлая. Взяли дочке (3 года), но чаще играем с мужем 😄, ",True
44,"От старшего ребёнка много лото осталось, но половинок не было. Взяла эти, хотя смутили отзывы, что карточки мол мнутся, рвутся. Открыла и прям обидно за игру. Отличные плотные прозрачные карточки, нормальные карточки поля. У нас много лото, и это очень классное, не уступает более дорогим. Единственное, что для прозрачных карточек нет пакетика или мешочка, чтобы внутри коробки не болтались, как это есть в некоторых версиях лото, но пакетики из икеа в помощь. Сама игра да за 280р просто огонь., ",True
45,"Со своего детства любила такие электронные викторины. Они тогда ещё на КБС-ках были. Одно время их не было совсем. Дочери не удалось купить.Очень обрадовалась, когда увидела для внука. Купила на именины! Ребятишки собрались, взрослые, кто помнил - восхищению не было предела! И радость встречи с любимой игрой, и новые красивые карты. Их подбор - ВСЁ! Кроме пустяка - разводка была бракованная. Описание животных или вопросов вело к неверным ответам.Пришлось вернуть в магазин. Если не только наша игра, а вся партия такая, придётся ждать, когда привезут другую. Пока взять ещё раз не рискнули, так как в магазине при покупке проверить нельзя. Только после оплаты. Ну пенсия не резиновая. Возврат через несколько дней. Купили другую игру., ",True
46,"как обычно - не может быть все удачно, если совместить 3 игры., ",True
47,"Карточки реалистичные,но пришлось потратить 40мин,чтоб на обратной стороне подписать всех и кто к чему относится. Покупала за 130р,впринципе для игры норм,но если бы подписи были заводские-удобнее было б однозначно. Нашла названия всех животных на офиц.сайте.
Город: люди, собаки, кошки, голуби
Ферма: коза, свинья, корова, куры
Лес: белка, заяц, лиса, медведь
Река: рак, лягушка, щука, бобёр
Пустыня: верблюд, тушканчик, ящерица, черепаха
Джунгли: леопард, тукан, броненосец, опоссум
Саванна: слон, жираф, антилопа, зебра
Прерии: сурок, гремучая змея, птица-секретарь, луговая собачка.
Арктическая пустыня:белый медведь, морж, морской котик, песец
Австралия: страус, утконос, кенгуру, ехидна., ",True
48,"Игра в мини-формате. 
Можно начинать играть с 3.6 лет вполне, придумав самим простейшие варианты заданий, используя несколько машин(например). 
Либо начиная с уровня новичок. 
Начиная от простого - к сложному. 
Главное показывать ребёнку, что машинки нужно двигать вперёд-назад, а не вытаскивать 🙂😃
Игра прекрасная, дайте папам, им понравится. 

, ",True
49,"Купили месяц назад , дети с увличением играют . Качество игры выше всех похвал. Можно играть в любом возрасте. На долго хватит,много уровней.Спасибо., ",True
