,review,assessment
122,"Идея хорошая, наряды красивые. Но качество магнитов ужасное, вообще не держатся на кукле. Прорезано всё очень плохо. , ",True
123,"Игра интересная, на внимательность и реакцию. Карточки тонкие, сразу оклеила скотчем, чтобы дольше послужили, а кубики покрыла лаком, тк скорее всего быстро сотрется рисунок. За свою цену отлично. Очень нравится жестяная коробочка. , ",True
124,"замечательный набор, не пронумерованы клетки, ",True
125,"Вообщем - хорошое издание Монополии, только жаль, что правила не изменили, я думаю, что можно было что нибудь придумать, но мне всё равно нравится 👍  
, ",True
126,"Ребенку очень понравилось, интересная задумка, необычная, развивает восприятие объемов, ",True
127,"Качество игры очень понравилось,то что за такую цену диадемки на голову сделаны из очень приятного пластика,не бумага.Играем всей семьёй, ребёнку 6 лет игра очень нравится. Немного просвечивают карточки,если на свет одеваешь,но не критично., ",True
128,"Хорошее качество исполнения, приятный пластик, приятные цвета. Отличное сочетание в игре развивающего элемента и игрушки! Просто так собирать задания ребенку было бы не интересно. Но дочка очень втянулась, потому что есть главные герои-кошки и мышки!) Суть игры-тетрис, но есть значительные усложнения! На вид все очень просто, но это только на вид. Есть над чем поломать голову. Дочке 3,5 года собирает уровень ""новичок"" с некоторыми подсказками., ",True
129,"симпатичная головоломка. не сложная, что дает возможность ребенку самому постараться и собрать и получить в итоге игрушку, ",True
130,"Подогнал по размеру и распечатал на фотобумаге цифры и нормальные буквы и приклеил в поля скотчем, да фишки маленькие и падают, но взял и обрезал коктейльную трубку на два части и положил в два поля каждому игроку. Трубкой удобно доставать упавшие фишки. Да, и колличество кораблей не как мы приввкли, но на коробке и не написано, что игра классическая. В целом же смысл игры сохранён. С детьми играем с удовольствием., ",True
131,"Фигурки пластмассовые
Доска при первом же использовании раскрутилась. 
Без коробки, пришли в обычном пакете. Своих денег не стоит, ",True
132,"Игра очень понравилась. Отлично развивает ребенка 2,5 лет., ",True
133,"Качество отвратительное, ",False
134,"Очень компактный, включив был удивлен что самой игры стройка нет, только благодаря наличию другого тетриса знал о переключении прошивки с полным комплектом игр, нигде не указано как включить. Зажмите клавиши звука и ресет, после ресет отпустите и несколько раз нажмите кнопку поворота детали..., ",True
135,"Невозможно пройти от начала и до конца, то заедает, то не достаёт шарик до цели, качество хромает, в 90е годы были лучше🤣вообщем одни сплошные минусы и нервы. Ребёнок в 3 года играть не может ну и родители тоже не смоли🤣, ",True
136,"Пластиковые карточки приятные на ощупь, яркие картинки, хорошие липучки и красивый дизайн в целом), ",True
137,"Брали на подарок,  именник доволен , ",True
138,"Интересная игра, детям нравится, ",True
139,"Достойные шашки за приятную цену! Порадовали, ",True
140,"Вау!, ",True
141,"Игра оправдала ожидания, хорошие задания от простого к сложному, ребёнок 5 лет занимается, ",True
142,"Взяли и себе, и подруге на д р. Дёшево и очень сердито! , ",True
143,"Ребкнку 3, 5 так не заинтересовала как меня … Может попозже станет интересна, ",True
144,"Очень хорошая головоломка, ",True
145,"ребенок любит все что связано с кубиком рубика. Сын в восторге, ",True
146,"Ребенку 1 год, заинтерисовало, собирает, ",True
147,"Обожаем игры от данного производителя. Купила, чтобы изучать цвета. Увлекает лучше всяких дорогущих игрушек., ",True
148,"Это самые ужасные шахматы. Если бы была возможность поставить оценку с минусом, она была бы., ",False
149,"Отличное домино, качественно сделано. Играем с ребёнком 4 лет, очень нравится., ",True
150,"Сами карты интересные. Разглядывать их и находить ассоциации одно большое удовольствие!Это второе дополнение, заказанное в ДМ и, наверное, последнее. Обе коробки пришли порванными. Вообще-то, коробка предназначена для хранения карт, поэтому хочется, чтобы она была в хорошем состоянии. Пришлось обклеить скотчем., ",True
151,"Игра очень красивая! Камни большие, приятные. Первые 40 заданий совсем простые, подойдут для детей 5-6 лет. Остальные сложнее и интересней. Ребёнок 8 лет прошёл все уровни. Игра понравилась., ",True
152,"Коробка металлическая, яркая. Игры интересные для детей от 5 лет. Но это явно не дорожная версия., ",True
153,"Очпнь качественный пластик, мягкий, гнётся, ребенку нравится придумывать свои варианты блюд, в идеале на возраст 2-4 года наверное. Мы брали по акции в друшом магазине за 210р, за 500 наверное дороговато, ",True
154,"Коротко и по делу:
1) качество литья деталек - так себе: на карабликах и фишках есть литники  и перемычки, об которые не то, что можно порезаться, но не особо приятно. И из за них детальки плохо, а иногда не встают в отверстия. Решается подрезкой острым ножом.
2) буквы и цифры на игровом поле того же цвета, что и само поле, по этому сливаются с полем, и очень, ну ооочень плохо читаются, их практически не видно. Для людей со слабым зрением будет боль и мучения играть в эту игру. Проблема решается краской кисточкой и прямыми руками.
3) фишки (снаряды/выстрелы) плохо держатся в своих ""гнездах"". Тут вкусовщина, кому как нравится, но игру лучше не трясти, и во время игры, переносить/передвигать медленно и аккуратно.
4) само игровое поле/кейс:
а) плохая защелка, почти не держит, очень легко открывается, одно неловкое движение, и ползание на корачках по полу, собирать рассыпаные детальки, вам обеспечнео.
б) кармашек для фишек (особенно белых) очень маленький. Очень много фишек просто не влазят в него. Будут лежать в пакетике.
в) как по мне, то угол открывания кейса, маленький, хотелось бы по больше, градусов так на 10.
г) качество пластика - сказать, что хорошее, у меня язык не поворачивается, но и откровенно дешёвым, я его назвать не могу. Будем посмотреть, время покажет. 
4) подарок в виде верёвочек и брашурки с узлами: задумка шикарная, но узлы... не самый удачный выбор узлов, есть гораздо более интересные и даже нужные узлы.

Игра не стоит этих денег. Красная цена  500-600 деревянных, но увы, имеем то, что имеем.
, ",False
155,"Классная занимательная игра, ",True
156,"Супер брали на подарок ребёнок 5 лет в восторге , ",True
157,"Всё целое. Детали обработаны хорошо. Занозы не оставляют, ",True
158,"Колода короша, картинки отличные, играем с д5тьми 8 и 12 лет, у нас уже 4 колоды дополнительные: кассиопея, одиссея, юбилейная,пандора, персифона, основная игра союзмультфильм.
Совет: союзмультфильм для мега малышей, картинки не очень, нет мелких деталей, остальные все крытые., ",True
159,"Хорошая головоломка. Интересна и взрослым. Если бы производитель учёл еще место для хранения деталей, было бы вообще супер. Бывает так, что игру нужно закончить не собрав задание, и раскладывать детали не когда., ",True
160,"Игра отлична, но качество карточек оставялет желать  лучшего. У нас есть 4 комплекта хтих игр (морские обитатели, в мире животных, зимняя и достопримечательности). И эти карточки единственные,  которые не ламинированы😒, ",True
161,"Качесто отличное. Наша любимая игра. Стоит своих денег., ",True
162,"Интересная, даже взрослым, ",True
163,"Компактная. Удобно брать с собой. Одна проблема, быстро выходят из строя маркеры., ",True
164,"Ребёнку нравится играть. Удобное в хранении и удобно брать в дорогу. , ",True
165,"Отличная игра. Сильно затягивает. Участникам раздается по 4 карты с цифрами. Берется из жёлтых одна карта. На  основе этой цифры составляются комбинации из карт (цифр) участников. Кто  первый. Можно использовать сложение, умножение, деление и вычитание. Кто составил первый забирает себе жёлтую карту. Кто больше соберёт, тот и выигрывает., ",True
166,"отлично , ",True
167,"Считаю оложительные  отзывы, нам не повезло., ",False
168,"Интересное содержание, задачи, но из- за того , что карточки тонкие и выгибаются , пользоваться игрой очень сложно. Выпрямляла под весом книг, ну особо помогло., ",True
169,"Отлично развивает , ",True
170,"Разочарована , ",False
171,"Карточки-поля из тонкого из картона, были немного выгнуты дугой, руками легко расправились. Карточки фишки из картона плотнее. 
За 100 рублей очень хорошее лото. Ребенку 2.2 понравилось играть, сам находил все и раскладывал без проблем, ",True
172,"Покупала для работы с подростками. Интересные, сложные словосочетания., ",True
173,"Хорошая качественная игра. Малышу 1,1 г. Таскает коробку, выдавливает фишки из рамки, пытается вставить обратно. Купила за 330 р. , ",True
174,"Жёсткий, ",True
175,"Супер!!!, ",True
176,"Бруски кривые, с классической Дженной не сравнится. 
, ",False
177,"Качественный шар, дочери очень любят играть , ",True
178,"Хорошая игра, играем всей семьей, сначала купили себе , затем и для подарка, ",True
179,"Видела под другим товаром отзыв, что этот бренд можно брать смело, рискнула приобрести пазлы. Качество отличное, дерево гладкое, как яичко! Все пазлы разрезаны по-разному, даже если форма разреза повторяется - то на одной картинке он идёт вертикально, а на другой горизонтально, так что с закрытыми глазами не соберёшь (это я к 1-му отзыву). Товар полностью соответствует фото и описанию, смотрите внимательно что берёте и для кого. Эти пазлы подойдут для самых маленьких, как первые пазлы в жизни, когда ребёнок ещё не умеет соединять детали стандартных пазлов. Картинки красивые, яркие. Все картинки не допиляны в двух местах по точечке, для транспортировки, нужно их доламывать, одна картинка при доставке сама разломалась - в месте соединения остались точечки не идеальной гладкости, но ими точно невозможно пораниться или получить занозу! Ребёнку пока не показывала, но если вызовут интерес именно как пазлы - обязательно куплю и другие. По цене кажется дороговато, но на самом деле за одну картинку получается не много, не больше, чем за подобные пазлы из картона или вспененые. Однозначно рекомендую попробовать приобрести хотя бы один набор., ",True
180,"интересная г оловоломкадля взрослых берите посложнее, ",True
181,"Размер фишек 3,5*3,5см. Карточки 15*11см. Хорошая подборка грибов, овощей, листьев и плодов деревьев, цветов. Фрукты стандартные для подобных игр. В карточке с ягодами виноград. Двояко - с одной стороны говорим ягоды винограда, но с другой стороны - он фрукт…, ",True
182,"Прекрасные карточки, но в нашей коробке два раза вложены карты от 2 до 5, с цветным фоном и с белым. С 6 до 9 карточек нет вообще.  Пришлось делать самой. Жаль, что при покупке сразу нельзя посмотреть комплектность, коробка затянута в плёнку., ",True
183,"Сначала не поняли, что к чему)) взрослые больше увлеклись до 2х ночи)) ребёнок 5 лет пока не очень увлекся, ",True
184,"Пишу отзыв, для реабилитации игры в глазах покупателей после нижнего негативного отзыва. Игра очень классная! Мы не читаем «простыни» правил, просто смотрим на ютуб пару обзоров. Лично мне нравится больше ДОС, чем простое УНО или  УНО ФЛИП. Так как очень классный тренажёр для мозга детей. Всего лишь несколько раз, мы играли партию быстро, иногда половина колоды «уходит» для закрытия партии. Мы сделали некоторые изменения правил для себя, когда нет нужной карты, берём одну из колоды и пропускаем ход; всегда кладём 2 карты из колоды и от себя, если есть «полное совпадение». Играем с сыном с 3,5 лет, ему очень нравится искать лучшие варианты «скидывание» карт. Сц, ",True
185,"Сложенная картонка с примитивной китайской схемой и скрипучей музыкой.Карточки с «отверстиями», которые ты сам должен сделать, если повезет и они не порвутся. Отвратительные задания, которые взрослый не разгадает из-за ряби в глазах., ",False
186,"Отличные карточки с головоломками. Дочка играет с большим удовольствием. Очень хорошо стираются карточки от маркера., ",True
187,"Игра очень понравилась нашему ребенку 3х лет - не оторвать от нее. Комплектность игры полная. Упаковка и формы все в хорошем состоянии. Мы довольны покупкой., ",True
188,"Хорошие фигуры и ужасная доска., ",True
189,"Отличная игра на логику. Дочери 3 года, играет с удовольствием., ",True
190,"Развивает мозги, ",True
191,"Внук очень доволен , прекрасная игра для развития. Даже взрослым интересно., ",True
192,"Хорошая игра. Я с дочерью закрепляю знание букв на ощупь. Это по мимо тех упражнений которые даны. И мне комплект очень понравился , ",True
193,"Качество сборки хорошее,всё двигается )
Осталось научится собирать))), ",True
194,"Очень качественно сделана настольная игра. , ",True
195,"удобно брать с собой, ",True
196,"Превосходная игра. Степени сложности позволяют с интересом играть и пятилетнему ребёнку, и взрослым. Качество материала отличное. Очень рекомендую для развития когнитивных способностей ребёнка. Продавцу благодарна за быструю и аккуратную доставку., ",True
197,"Чудесная крепкая змейка , ",True
198,"Увлекательно для детей с 4 лет. Дети очень любят играть в домино ! Уже 4 вида взяла 🙂, ",True
199,"Хорошие качества, ",True
200,"Прекрасная игра! Дочке 6 лет очень понравилась. Продумано хранение карточек с заданиями в отдельном отсеке. Задания структурированны от легкого к сложному , ",True
201,"Сыну 9 лет подарила на новый год 7 разных игр, но это самая любимая среди Клюэдо, коров и других классных игр. Фанатеет просто, ловко кидает кубики и выигрывает, старший сын 19 лет тоже, не поверите, любит с нами играть, играем всей семьёй. 
Огромный плюс для сына, что остальные игры в основном карточные, а в этой фигурки, поля интересные.
А мне нравится, что игра не затяжная, азартная и быстрая.
Оооочень качественно сделано всё и цена сууупер.
Спасибо ДМ!!!, ",True
202,"Хорошая головоломка 👍🏻, ",True
203,"Зашло на ""ура""! Пригодилось даже для первого класса: по математике были геометрические  задания. Советую брать!, ",True
204,"Классное, да ещё и с камушкам))), ",True
205,"Магнитные геометрические фигуры очень плохо примагничиваются. Постоянно смещаются. Они настолько тонкие, что все в тот же день размахрились. Хотя мы собрали всего 1 картинку. Ребенку 3 года. Не интересно. Карточки с рисунками постоянно смещаются с магнитной основы. Ее надо чем то закреплять. Разочарование от покупки. Лучше взять что то дороже, чем такую ерунду купить. Если б я видела что внутри коробки - не взяла бы, ",False
206,"Хорошо, что в современном мире появляются новые игры, которые не только развлекают и отвлекают, но и развивают логику и мышление!, ",True
207,"Игра просто отличная, купили для ребёнка 4 лет, очень интересная и простая,  дочка в восторге! На что хочу обратить внимание, при покупке данных игр проверяйте комплектацию, т. к. прежде чем я оплатила свой заказ, попросила игру открыть (т.к. никаких наклеек на коробке не было) в итоге оказалось, что не хватает мешочка для кубиков (комплектация: 13 кубиков, мешочек, инструкция, коробка для хранения), товар тут же обменяли! За это большое спасибо! Играем всей семьёй., ",True
