,review,assessment
340,"Хорошая игра, развивает логику. Первые уровни конечно же довольно элементарные, подойдут даже для малышей. Но по мере увеличения уровней игра заставляет поломать голову и даже взрослому. В общем, это хорошая развлекалка с большой пользой. Отвлекла даже ребенка от телефона., ",True
341,"Забавная обезьянка, игра интересная. Дети 3 и 5 играют вместе., ",True
342,"Хорошая игра, красивая, понравилась и дочкам, и родителям, ",True
343,"Очень интересная идея:3 игры в 1 коробочке, правда формат-карманный(размером с мобильный телефон всего в сложенном виде, а в разложенном вдвое больше) Зато в любую поездку можно брать, места не займёт, фишки держатся хорошо на досочке, если упадёт фишка, то найти её с помощью остальных фишек(примагничиваются хорошо?) играть ""пуговками от рубашки"" ощущения неожиданные?, но ни разу не промахнулся мимо фишки никто из игроков?Рекомендую к покупке-забавная игра!, ",True
344,"Приятные маленькие блоки, машинка хорошо катается. Голову хорошо поломать даже взрослым! Бабушка уже повышенный уровень не решила. Ребенку можно и с 3х лет давать самые элементарные задания. Более сложные уровни натренированный ребенок лет 7 думаю решит. Но я сама не с первого раза решила)))Взяла 2м детям 2 и 7 лет . Именно мини версию. Для занятий в поездках., ",True
345,"Как человек с высшим образованием в радиоэлектронике, могу ответственно утверждать - качетсво негодное. Викторины из нашего детства делались с проводниками из фольги, кешированной на картон. Эта же ради снижения себестоимости сделана печатью графитовой краской. Слой краски микроскопический (сопротивление между точками порядка 2 кОм!) и малейшая трещинка = обрыв. А трещинки запросто возникнут из-за второго удешевления конструкции - игровое поле сделано в виде коробки из тонкого картона. Итог - ребенок случайно облокотился или чуть посильнее нажал, картон прогибается и трескается, тончайший слой краски - повреждается. Все. Поскольку краска сверху заклеена слоем бумаги, то и восстановить нельзя - так можно было бы подкрасить той же графитовой краской, но как идет проводник неясно, не видно на просвет и не угадывается по рельефу (слой микроскопический). Дешевка до первого случая., ",False
346,"Коробка большая а карточки маленькие,еще нет магнитов.(((, ",True
347,"Игра интересная, со старшим сыном играем разные варианты по инструкции (6лет). Даже бабушка разобралась ? младшему (2) нравится просто выкладывать дорогу. Плотный картон, игра прослужит долго! Рекомендую ?, ",True
348,"Заказала дочке в дополнение к подарку на День рождения, чтобы потом взять игру в отпуск. Не успели открыть, поле сломалось на 2 части. Ужасный запах, который бывает у китайских подделок. Очень мелкое поле для игры-бродилки. Купила из-за хорошего отзыва, но сама не рекомендую никому покупать эту игру. Она одноразовая., ",False
349,"Как можно пропечатать книжку с заданиями с грубейшими ошибками! Ну не получается при наложении карточек нужная картинка машины. Теряется весь обучающий смысл игры, ребёнок видит , что не получается машинка и пропадает интерес. Один раз, другой, опять и опять- то же самое - ошибки в книжке с итоговыми машинками!!! Отвратительно, первый раз встречаюсь с таким в детских играх. Ориентировалась на отзывы на других сайтах, видимо все куплено, все положительные и сейчас понимаю - однотипные.Как же вам не стыдно, «уважаемый» производитель!!!!, ",False
350,"Очень интересная игра. Не требует участия родителя. Что для меня, многодетной мамы, очень удобно. Обязательно приобрету полный набор, ",True
351,"В целом, задумка неплохая, но... За такие деньги, даже со скидкой, исполнение могло быть и лучше. Если честно, я ожидала, что хотя бы схема будет расположена и закреплена в пластике и на неё можно будет накладывать карточки. Но нееет. Отдельно схема, отдельно карточки, отдельно светозвуковой механизм. И размещается все это чудо просто в картонной коробке, что жутко неудобно!!! Края коробки, в которой нужно разместить и блок со светозвуковым механизмом и плату с карточкой, достаточно высокие, то схема съезжает, то карточка, получается несостыковка перфорации на карточках и узлов на схеме, что жутко раздражает и меня и ребёнка. Считаю, что цена на данный товар завышена., ",True
352,"Мало того что создана двумя ветеранами в своих областях, так еще и сама уже подходит к почтенному возрасту, т.к. в этом году отметит четыре года (даже классическая Монополия обновляется чаще), оставаясь при этом неприлично актуальной (вот прошло время, а она будто бы анонсирована только вчера). Жаль, что она по сроку давности скоро снимется с продаж вовсе - дважды в одну и ту же реку войти нельзя. Игра напрочь лишена главного недостатка всех игр (от Го до Каркассона) - всепоглощающего манчкинизма, убивающего удовольствие почти от любой партии, где даже у победителей остается какое-то горькое послевкусие от игры. Геймер же может похвастаться не только завидным мультиплеером (до 12 участников, каждый из которых чувствует себя по-настоящему уникальным, равноценно участвует в процессе, а также всегда доходит до конца игры), но даже небывалым для настолок режимом одиночной игры (особенно со всеми тремя ипостасями Марио в комплекте). А если подключить обширную коллекцию нинтендовских аксессуаров, то игру можно проапгрейдить до невиданных масштабов (кстати, оригинальные поля для отелей/домов не убраны, аккурат для Гумб, Пираний или мини-замков принцессы Пич)... эдакий настольный Mario Maker, развивающий воображение не хуже, а то и лучше всяких Minecraft. При этом во время игры, в отличие от оригинального Mario, вам не придется кидаться фигурками, ломать игровое поле, тратить свои драгоценные нервы на десятикратное прохождение одного и того же круга/босса (первый раз, когда правила Монополии сыграли положительную роль).Отдельно хочется сказать о персонажах, ведь каждый из них обладает своей историей, харизмой и приятной, узнаваемой внешностью (герои Монополии оживают лишь раз в сто лет, кажется, мы являемся свидетелями первого парада фигурок). Благодаря многолетней поддержке от японского геймдизайна персонажи, - чей окончательный облик был сформирован еще в нулевых, - сблизят не одно поколение, а это в наше время очень большая редкость, особенно в мире детей (попробуйте через пару лет открыть какую-нибудь Монополию ""Fortnite"" или ""Игру престолов""... скука, скука и скука). Теперь ложечка дегтя, и это не инструкция на ломанном русском. Дело в том, что Россия лишена Коллекционного издания. Там есть Боузер с личной игровой карточкой, спецвкладыш для всех шести аддонных персонажей (какой сервис!), пластиковые монетки, стилбук и даже кости лучше! Минус в карму нинтендовским маркетологам!, ",True
353,"Классная и качественная мозаика, сына не оторвать :)) очень любит космос и все с ним связанное :), ",True
354,"Цвета яркие,картинки добрые, ",True
355,"Игра явно не рассчитана на детей.заказали через интернет магазин и разочарованы. Считать калории совсем не интересно, ",True
356,"Шахматы отличные, своих денег однозначно стоят, ",True
357,"Резкий запах клея, ",False
358,"Качественная игра с интересными заданиями, рекомендую., ",True
359,"Яркое лото, ",True
360,"Хорошая упаковка, ",True
361,"Цена ей 300 рублей максимум, для первой детской доски пойдёт. Но сейчас бы не купил. , ",False
362,"Классная игра, хорошо продумана производителем. Много заданий, уровней сложности, есть даже отделение для хранения деталей. Отлично!, ",True
363,"Быстрая веселая игра на внимательность детям лет от пяти, ",True
364,"Ужас, ",False
365,"Хороший набор. дети узнали, как выглядит кукушка), ",True
366,"Прорисовка отличная, липички хорошо клеются, мячик аккуратный без повреждений. Играть одно удовольствие. Игра подайдет с 3,5-4 лет, там ничего не надо считать, вместо цифр там ягоды, орехи и колоски. Игра кооперативная, игроки против игры. Есть две сложности игры. В лёгкой версии ничего тяжелого, ребёнок 3,9 г. прошёл без помощи. , ",True
367,"Хорошее лото. Ребёнку очень понравилось. , ",True
368,"Качество исполнения ужасное. 650 руб она не стоит вообще. Заказали по промокоду и за балы,вышло 350 руб. Понравился размер. Крепления кривые , сбоку в дереве дыра. Заказывала на пункт выдачи , до магазина ехать далеко. Сборщику большой минус ., ",False
369,"Отличная игра! 
Ребёнок сразу заинтересовался., ",True
370,"Небольшие по размеру, но играть можно!
Объективно, за небольшие деньги, хорошие шахматы👍, ",True
371,"хорошая игра., ",True
372,"Игра хорошая, наверное, но пришла облитая шампунем, ",True
373,"В целом игра выполнена не плохо и стоит своих денег если не одно но, это карачки с заданиями, вернее одна инструкция, на которой напечатаны микроскопическим шрифтом все задания,  и вся информация о правилах игры. Что-бы рассмотреть задание на карточке, необходимо вглядываться и сильно напрягать зрение. Один уровень сложности, с перечнем заданий занимает место с спичечный коробок. Мне искренне не понятно, зачем надо было экономит на карточках и портить все впечатление как по изделию в целом так и об игре., ",True
374,"Все хорошо, качество отличное за такую цену. Покупала по акции, ",True
375,"Игра очень интересная. Вся семья играет от 5 лет и до 70 лет))))))), ",True
376,"Отличная игра., ",True
377,"Покупала на подарок. На первый взгляд квадраты выполнены аккуратно, цвета яркие., ",True
378,"Класс, ",True
379,"Отличный товар. Много уровней сложности. , ",True
380,"Отличный подарок для маленьких балерин 🤩 заказали на открытый урок по балету в группу для девочек 5-6 лет, ",True
381,"Товар пришел бвстро, аккуратно упаковано. Вкучке понравилось, ",True
382,"Хорошая игра но есть один минус деньги нужно вырезать самим, ",True
383,"Сложно для ребенка 3 лет., ",True
384,"понравилось что разные уровни сложность,можно расти и развиваться,очень интересно, ",True
385,"Хорошая игра,все что ждали от нее получили, ",True
386,"Понравилась,играют даже взрослые,разные уровни сложности.качественно, ",True
387,"Хорошая игра,качественная,продуманая, ",True
388,"Как и вся продукция от ""Харди гарди"" эта игра очень красивая и качественная. Магниты прекрасно крепятся к полю, базу от магнитов можно потом использовать как сортер. Иллюстрации красивые, ",True
389,"Я являюсь большим поклонником игр ""Харди Гарди"", моей дочке (2,5) очень нравятся и пазлы, и магнитные игры. У нас есть почти все из их ассортимента, что нам подходит по возрасту, ",True
390,"Развивашка крутая,берем уже не первую игру, ",True
391,"Сма с удовольствием играю в эту игру,пластик качествинный даже тактильно приятно, ",True
392,"Супер,ребенку 4 года зашла на ура, ",True
393,"Отличная игра! Ребенок быстро освоил, играет с удовольствием , ",True
394,"Отлично выполненная головоломка., ",True
395,"достаточно увлекательно! дети довольны, ",True
396,"Качественный столик и интересный логические задания,очень довольны, ",True
397,"👍 , ",True
398,"интерсная задумка,и хорошее ее исполнение, ",True
399,"Отлично, ",True
400,"Отличная игра, карточки яркие, ребёнку нравится, ",True
401,"В эту игру действительно могут играть даже взрослые так как заставляет не плохо напрягать мозги, ",True
402,"Неплохое домино, не прокрашены некоторые точки или краска нанесена с избытком. А так, приятный на ощупь, легко играть., ",True
403,"Интересная и полезная игра и для детей, и для взрослых! , ",True
404,"Отличные классические шахматы. Поле слишком большое для фигур идущих в комплекте. Поле быстро пачкается, т.к. имеет ворсовую поверхность, ",True
405,"Ребёнку понравилось, ",True
406,"Отличный рубик, ",True
407,"Интресно, но часть вопросов не понравилось по содержанию. Провести весело время с детьми можно., ",True
408,"Брала внучке, играет, ",True
409,"Мне понравилась головодомка. Типа кубика Рубика., ",True
410,"Интересная игра, ",True
411,"Это домино в виде надутого пластика, а не костяшек, выбирал чтобы перейти от рисунков и цифр, к стандартному домино.. размер больше чем обычные костяшки, во взрослой руке не умещаются, а в детской тем более. Больше разочаровала само качество костяшек, ну и футляра для хранения нет, ",True
412,"Классика, нейропсихологи считают, что должен пройти каждый ребёнок кубики Никитина, а с альбомом это делать интересней ), ",True
413,"В восторге, у нас много игр этой фирмы и будем продолжать покупать. , ",True
414,"В целом, цена соответствует качеству. Играть можно после того как зачистишь грани мелкозернистой наждачной бумагой, т.к. на одной из граней по всем цифрам остался заусениц от литья, соответственно, этим заусенцем цифра цепляет соседние, в итоге, выталкивает их со своего места. , ",True
415,"Очень плотный картон. Приятные на ощупь, ",True
416,"Отличная игра! Наборы одежды разнообразные., ",True
417,"Отличная игра! Брала на подарок мальчику 5и лет. Ребенку понравилось и маме тоже., ",True
418,"Нам понравилось, ",True
419,"интересно, но мое личное пожелание, поплотнее карточки, и магнитные детали. детям 3, нравится, но карточки мнутся, и боятся воды., ",True
420,"Играем с удовольствием, ",True
421,"Это наша вторая игра 7 на 9! Первая была про сложения! Детям нравятся, но сначала трудно,  потому что медленно складывают и умножают, но со временем все быстрее и быстрее!, ",True
422,"Отличная игра, ",True
423,"Хороший брелок, но у него наклейки вместо пластика. , ",True
424,"Не понравилось абсолютно.Мелкие детали, ин.алфавит, бестолково.Лучше по- старинке нарисовать от руки и играть в свое удовольствие, ",True
425,"Отлично на подарок, ",True
426,"Очень хорошая игра. Сын 9 лет с удовольствием играет., ",True
427,"Детям понравилось))
Но играть дам, когда хотя бы по 1,5 года будет. , ",True
428,"увлекательная, ",True
429,"Купила по скидке, за 190 рублей. Думала малой подрастёт, будет интересно животных запоминать, считать( в игре присваивается навыки счета, лапки, ушки животных и изучения цвета, домики животных.
В итоге старшие лети 9 и 12 подсели играть!!!!!
И нам взрослым интересно с детками играть!, ",True
430,"Цена и качество отличные!  Три уровня сложности и цветные картинки. , ",True
431,"Отличный геоборд! Все очень мило упаковано, внутри понятная и красочная инструкция., ",True
432,"Красивые яркие наклейки с героями из мультика.
Детям очень нравится, ",True
433,"Отличная игра , ",True
434,"Очень крутая игра. Купила ребенку, сама ""залипла"". Увлекает надолго, ",True
435,"Отличное качество, ",True
436,"класс! много карточек. познавательные факты о космосе, много фигурок, однозначно цена=качество, ",True
437,"развивашка, ",True
438,"Суперская монополия! Очень интересно в неё играть! Карта яркая и красочная, классно стилизованная, красивые металлические фигурки. , ",True
439,"Сделана из дерева, сверху закрыта прозрачным экраном, так что шарик не вывалится. Рекомендую!, ",True
440,"Хорошая развивающая игра. , ",True
441,"👍👍👍👍👍, ",True
442,"Понравилось, что животные на картинках похожи сами на себя. И есть цифры - ребенок постарше будет учиться считать  , ",True
